<?xml version="1.0" encoding="UTF-8"?>
<tns:architecture xmlns:tns="http://www.example.org/SAFe_architecture_V2" xmlns:xsi="http://www.w3.org/2001/XMLSchema-instance" xsi:schemaLocation="http://www.example.org/SAFe_architecture_V2 SAFe_architecture_V2.xsd ">
  <tns:application id="0">
  	<tns:env_ports>
  		<tns:provides name="app_env_port_a" id="01"/>
  		<tns:provides name="app_env_port_b" id="02"/>
  		<tns:uses name="app_uses_port_a" id="03"/>
  	</tns:env_ports> 
  </tns:application>
  	
  <tns:workflow id="1">
  	<tns:env_ports>
  		<tns:provides name="wf_uses_port_a" id="11"/>
  		<tns:provides name="wf_uses_port_b" id="12"/>
  		<tns:uses name="wf_uses_port_a" id="13"/>
  	</tns:env_ports> 
  </tns:workflow>
  
  <tns:body>
  	
  	<tns:computation name="comp_20" id="20">
  		<tns:env_ports>	
  			<tns:provides name="cmp_uses_port_a" id="21"/>
  			<tns:provides name="cmp_uses_port_b" id="22"/>
  			<tns:uses name="cmp_uses_port_a" id="23"/>
  		</tns:env_ports>
  		<tns:task_ports>
  			<tns:task_port name="task_a" id="24"/>
  			<tns:task_port name="task_b" id="25"/>
  		</tns:task_ports>
  	</tns:computation>
  	
  	<tns:connector name="comp_30" id="30">
  		<tns:env_ports>	
  			<tns:provides name="cmp_uses_port_a" id="31"/>
  			<tns:provides name="cmp_uses_port_b" id="32"/>
  			<tns:uses name="cmp_uses_port_a" id="33"/>
  		</tns:env_ports>
  		<tns:task_ports>
  			<tns:task_port name="task_a" id="34"/>
  			<tns:task_port name="task_b" id="35"/>
  		</tns:task_ports>
  	</tns:connector>
  	
  	<tns:platform name="comp_40" id="40">
  		<tns:env_ports>	
  			<tns:provides name="cmp_uses_port_a" id="40"/>
  			<tns:provides name="cmp_uses_port_b" id="41"/>
  			<tns:uses name="cmp_uses_port_a" id="42"/>
  		</tns:env_ports>
  		<tns:task_ports>
  			<tns:task_port name="task_a" id="43"/>
  			<tns:task_port name="task_b" id="44"/>
  		</tns:task_ports>
  	</tns:platform>
  	
  	<tns:repository name="comp_50" id="50">
  		<tns:env_ports>	
  			<tns:provides name="cmp_uses_port_a" id="51"/>
  			<tns:provides name="cmp_uses_port_b" id="52"/>
  			<tns:uses name="cmp_uses_port_a" id="53"/>
  		</tns:env_ports>
  		<tns:task_ports>
  			<tns:task_port name="task_a" id="54"/>
  			<tns:task_port name="task_b" id="55"/>
  		</tns:task_ports>
  	</tns:repository>
  	
  </tns:body>
  
  <tns:attachment>
    <tns:uses name="app_uses_port_a" id="03"/>
    <tns:provides name="cmp_uses_port_b" id="41"/>
  </tns:attachment>
  
  <tns:attachment>
    <tns:uses name="cmp_uses_port_a" id="33"/>
    <tns:provides name="cmp_uses_port_b" id="22"/>
  </tns:attachment>
  
 
</tns:architecture>
